id,text,date,author_id
1,"Morbi porttitor lorem id ligula. Suspendisse ornare consequat lectus. In est risus, auctor sed, tristique in, tempus sit amet, sem.",2016-03-30 04:30:41,1
2,"Praesent blandit. Nam nulla. Integer pede justo, lacinia eget, tincidunt eget, tempus vel, pede.",2016-10-29 03:18:26,2
3,"Fusce posuere felis sed lacus. Morbi sem mauris, laoreet ut, rhoncus aliquet, pulvinar sed, nisl. Nunc rhoncus dui vel sem.",2016-05-14 09:14:17,3
4,"Nam ultrices, libero non mattis pulvinar, nulla pede ullamcorper augue, a suscipit nulla elit ac nulla. Sed vel enim sit amet nunc viverra dapibus. Nulla suscipit ligula in lacus.",2017-03-01 09:07:51,4
5,Phasellus sit amet erat. Nulla tempus. Vivamus in felis eu sapien cursus vestibulum.,2016-05-17 19:48:10,5
6,Cras non velit nec nisi vulputate nonummy. Maecenas tincidunt lacus at velit. Vivamus vel nulla eget eros elementum pellentesque.,2016-12-22 13:24:48,6
7,Sed ante. Vivamus tortor. Duis mattis egestas metus.,2017-02-08 13:52:09,7
8,Phasellus sit amet erat. Nulla tempus. Vivamus in felis eu sapien cursus vestibulum.,2017-01-13 19:11:51,8
9,Praesent id massa id nisl venenatis lacinia. Aenean sit amet justo. Morbi ut odio.,2016-11-16 03:02:17,9
10,"Praesent blandit. Nam nulla. Integer pede justo, lacinia eget, tincidunt eget, tempus vel, pede.",2016-06-03 10:34:38,10
11,In quis justo. Maecenas rhoncus aliquam lacus. Morbi quis tortor id nulla ultrices aliquet.,2016-09-14 19:11:54,11
12,Praesent id massa id nisl venenatis lacinia. Aenean sit amet justo. Morbi ut odio.,2016-12-03 04:36:49,12
13,"Vestibulum quam sapien, varius ut, blandit non, interdum in, ante. Vestibulum ante ipsum primis in faucibus orci luctus et ultrices posuere cubilia Curae; Duis faucibus accumsan odio. Curabitur convallis.",2017-01-03 08:26:02,13
14,In quis justo. Maecenas rhoncus aliquam lacus. Morbi quis tortor id nulla ultrices aliquet.,2016-06-13 11:44:57,14
15,"In hac habitasse platea dictumst. Morbi vestibulum, velit id pretium iaculis, diam erat fermentum justo, nec condimentum neque sapien placerat ante. Nulla justo.",2016-07-08 17:10:34,15
16,"Proin leo odio, porttitor id, consequat in, consequat ut, nulla. Sed accumsan felis. Ut at dolor quis odio consequat varius.",2016-11-05 19:32:54,16
17,"In sagittis dui vel nisl. Duis ac nibh. Fusce lacus purus, aliquet at, feugiat non, pretium quis, lectus.",2016-12-15 02:08:58,17
18,Integer ac leo. Pellentesque ultrices mattis odio. Donec vitae nisi.,2016-11-18 23:09:49,18
19,"Duis bibendum, felis sed interdum venenatis, turpis enim blandit mi, in porttitor pede justo eu massa. Donec dapibus. Duis at velit eu est congue elementum.",2016-03-14 09:58:34,19
20,Integer tincidunt ante vel ipsum. Praesent blandit lacinia erat. Vestibulum sed magna at nunc commodo placerat.,2016-07-08 09:50:48,20
21,"Lorem ipsum dolor sit amet, consectetuer adipiscing elit. Proin risus. Praesent lectus.",2017-01-12 11:25:28,21
22,Integer tincidunt ante vel ipsum. Praesent blandit lacinia erat. Vestibulum sed magna at nunc commodo placerat.,2016-11-28 11:30:33,22
23,Fusce consequat. Nulla nisl. Nunc nisl.,2016-05-26 03:55:08,23
24,"Aenean fermentum. Donec ut mauris eget massa tempor convallis. Nulla neque libero, convallis eget, eleifend luctus, ultricies eu, nibh.",2016-07-23 11:21:41,24
25,Duis consequat dui nec nisi volutpat eleifend. Donec ut dolor. Morbi vel lectus in quam fringilla rhoncus.,2016-10-20 20:07:57,25
26,"Nam ultrices, libero non mattis pulvinar, nulla pede ullamcorper augue, a suscipit nulla elit ac nulla. Sed vel enim sit amet nunc viverra dapibus. Nulla suscipit ligula in lacus.",2017-02-14 14:03:43,26
27,"Quisque porta volutpat erat. Quisque erat eros, viverra eget, congue eget, semper rutrum, nulla. Nunc purus.",2016-07-06 05:05:14,27
28,Pellentesque at nulla. Suspendisse potenti. Cras in purus eu magna vulputate luctus.,2016-11-09 05:19:14,28
29,Sed ante. Vivamus tortor. Duis mattis egestas metus.,2017-03-09 18:12:14,29
30,"Curabitur at ipsum ac tellus semper interdum. Mauris ullamcorper purus sit amet nulla. Quisque arcu libero, rutrum ac, lobortis vel, dapibus at, diam.",2016-05-25 01:27:28,30
31,Duis bibendum. Morbi non quam nec dui luctus rutrum. Nulla tellus.,2017-02-15 09:56:26,31
32,"Duis bibendum, felis sed interdum venenatis, turpis enim blandit mi, in porttitor pede justo eu massa. Donec dapibus. Duis at velit eu est congue elementum.",2016-10-18 01:29:45,32
33,Aliquam quis turpis eget elit sodales scelerisque. Mauris sit amet eros. Suspendisse accumsan tortor quis turpis.,2016-11-20 01:38:13,33
34,Etiam vel augue. Vestibulum rutrum rutrum neque. Aenean auctor gravida sem.,2017-02-25 11:39:32,34
35,Integer ac leo. Pellentesque ultrices mattis odio. Donec vitae nisi.,2016-04-04 19:11:52,35
36,"Praesent blandit. Nam nulla. Integer pede justo, lacinia eget, tincidunt eget, tempus vel, pede.",2016-10-25 20:12:19,36
37,Nullam sit amet turpis elementum ligula vehicula consequat. Morbi a ipsum. Integer a nibh.,2016-10-01 14:22:07,37
38,Praesent id massa id nisl venenatis lacinia. Aenean sit amet justo. Morbi ut odio.,2017-01-10 11:35:27,38
39,Duis bibendum. Morbi non quam nec dui luctus rutrum. Nulla tellus.,2016-08-11 04:27:31,39
40,"Morbi porttitor lorem id ligula. Suspendisse ornare consequat lectus. In est risus, auctor sed, tristique in, tempus sit amet, sem.",2017-03-03 02:35:45,40
41,"In hac habitasse platea dictumst. Morbi vestibulum, velit id pretium iaculis, diam erat fermentum justo, nec condimentum neque sapien placerat ante. Nulla justo.",2016-11-13 12:53:03,41
42,"Aenean fermentum. Donec ut mauris eget massa tempor convallis. Nulla neque libero, convallis eget, eleifend luctus, ultricies eu, nibh.",2016-04-13 03:25:43,42
43,"Curabitur at ipsum ac tellus semper interdum. Mauris ullamcorper purus sit amet nulla. Quisque arcu libero, rutrum ac, lobortis vel, dapibus at, diam.",2017-01-16 04:46:20,43
44,"Fusce posuere felis sed lacus. Morbi sem mauris, laoreet ut, rhoncus aliquet, pulvinar sed, nisl. Nunc rhoncus dui vel sem.",2016-11-22 04:33:32,44
45,"In sagittis dui vel nisl. Duis ac nibh. Fusce lacus purus, aliquet at, feugiat non, pretium quis, lectus.",2016-10-18 18:30:02,45
46,Nulla ut erat id mauris vulputate elementum. Nullam varius. Nulla facilisi.,2016-04-30 03:22:00,46
47,Duis aliquam convallis nunc. Proin at turpis a pede posuere nonummy. Integer non velit.,2016-08-06 04:37:56,47
48,Phasellus sit amet erat. Nulla tempus. Vivamus in felis eu sapien cursus vestibulum.,2016-11-29 09:48:14,48
49,"Cras mi pede, malesuada in, imperdiet et, commodo vulputate, justo. In blandit ultrices enim. Lorem ipsum dolor sit amet, consectetuer adipiscing elit.",2016-08-30 22:28:46,49
50,"Maecenas tristique, est et tempus semper, est quam pharetra magna, ac consequat metus sapien ut nunc. Vestibulum ante ipsum primis in faucibus orci luctus et ultrices posuere cubilia Curae; Mauris viverra diam vitae quam. Suspendisse potenti.",2017-02-02 19:23:31,50
